<?xml version="1.0" encoding="UTF-8" ?>

<alberghi xmlns="https://www.alberghi.it" xmlns:xsd="http://www.w3.org/2001/XMLSchema-instance" xsd:schemaLocation="alberghi.xsd">
	<albergo categoria="****">
		<nome>Hotel Astoria</nome>
		<citta>Roma</citta>
		<tel>06237813</tel>
		<cell>353134125</cell>
		<prezzo stanza="singola">120</prezzo>
		<prezzo stanza="doppia">200</prezzo>
	</albergo>
	<albergo categoria="*">
		<nome>Pensione Scatafascio</nome>
		<citta>Roma</citta>
		<tel>068872382</tel>
		<prezzo stanza="doppia">50</prezzo>
		<prezzo stanza="singola">40</prezzo>
	</albergo>
</alberghi>
